"1,Butt Lift Stomach Wrap,WANT TO CORRECT YOUR BODY AND LIFT YOUR BUTT AT 
THE SAME TIME? OUR SILICONE SHAPEWEAR IS THE SOLUTION FOR "
"YOU,162.13,,,2023-03-06,""Fitness, Shapewear"""
"2,Butt Lifter Shorts,SASSY SHAPEWEAR® BUTT LIFTER SHORTS WOMEN SHAPEWEAR 
MID-RISE DOUBLE TUMMY CONTROL PANTY SLIMMER BODY SHAPER,72.68,,,2023-03-
06,Shapewear"
"3,BUTT LIFTING SWEAT LEGGING,WANT TO CORRECT YOUR BODY AND LIFT YOUR BUTT 
AT THE SAME TIME? OUR SILICONE SHAPEWEAR IS THE SOLUTION FOR 
YOU,98.77,,,2023-03-06,""Fitness, Shapewear"""
"4,Sassy BBL,WANT TO CORRECT YOUR BODY AND LIFT YOUR BUTT AT THE SAME TIME? 
OUR SILICONE SHAPEWEAR IS THE SOLUTION FOR YOU,137.91,,,2023-03-
06,""Maternity, Shapewear"""
"5,High Waist Period Underwear,,22.36,,,2023-03-06,Waist Trainer/Corset
6,Latex corset waist trainer 9 steel bone,,91.32,,,2023-03-06,Waist 
Trainer/Corset"
"7,Twenty Five Steel Bones Latex Corset Waist Trainer,,123,,,2023-03-
06,Waist Trainer/Corset"
"8,Twenty Five Steel Bones Latex vest Corset Waist Trainer,,128.59,,,2023-
03-06,Waist Trainer/Corset"
"9,Compression Shorts,SASSY SHAPEWEAR® BUTT LIFTER SHORTS WOMEN SHAPEWEAR 
MID-RISE DOUBLE TUMMY CONTROL PANTY SLIMMER BODY SHAPER,123,,,2023-03-
06,Shapewear"
"10,Deep V Backless Thong,""Fabric Type 85% Nylon, 15% Spandexfor wearing  
under dresses, skirts, jeans and pants during pregnancy and 
postpartum"",91.32,,,2023-03-06,Shapewear"
"11,High Waisted Shorts Double Tummy Layer,""So Comfy... Like the Second 
Layer of Skin. This seamless breathable body shaper shapes your body 
without flattening your butt. Wear it to the gym, office, or out on the 
town."",147.22,,,2023-03-06,Shapewear"
"12,Hour Glass Faja,""Comfortable, soft, elastic and seamless suitable for 
wearing  under dresses, skirts, jeans and pants during pregnancy and 
postpartum."",139.77,,,2023-03-06,Shapewear"
13,Seamless Tummy Control Thong,,48.45,,,2023-03-06,Shapewear
"14,Side Zipper Super Control,""Material: This shape wear thigh slimmer is 
made of 30% spandex+70% nylon, breathable and smooth fabric can provide 
comfortable and smooth touch feeling as well as keep your body comfortable 
and dry."",141.63,,,2023-03-06,Shapewear"
"15,Waist Trainer Legging,""SIZE UP SIZE UP IF YOU DO NOT LIKE A VERY TIGHT 
FIT Fabric: Nylon, Spandex, Smooth, Compressive, Flexible, 3 Way Stretchy 
• Features: Invisible butt contour inside to lift your butt; Squat Proof; 
Slim effect; No rolling down, a good amount of support. The waistband is 
6.4 inches high"",100.63,,,2023-03-06,""Maternity, Shapewear"""
"16,Zip Thigh Shaper,Sassy shapewear ® has the latest compression 
technology. The Powernet on the external layer of these strapless shapers 
ensures great control over troubled areas. Its cotton lining allows more 
comfort and caresses your skin. ,143.5,,,2023-03-06,Shapewear
17,Breastfeeding Bra,Our soft and comfortable breastfeeding bra made with 
high quality nylon-spandex fabric designed for fluctuating breast sizes. 
Enjoy motherhood in comfort.,29.82,,,2023-03-06,Maternity"
"18,Faja Colombian bra shapewear,,158.4,,,2023-03-06,Maternity
19,Maternity High Waist pants,""Comfortable, soft, elastic and seamless 
suitable for wearing  under dresses, skirts, jeans and pants during 
pregnancy and postpartum."",10.81,,,2023-03-06,Maternity"
"20,Maternity High Waist Yoga Pants,""Perfect for yoga, biking, volleyball, 
exercise, fitness, weightlifting, running, any type of workout, or 
everyday casual use."",46.59,,,2023-03-06,Maternity"		
"21,Lelinta,Men Waist Trainer Vest for Weight Loss Hot Neoprene Body Shaper 
with Zipper Sauna Suit TaLELINTA Top Workout Shirt,14.99,,,2023-03-
06,Waist Trainer"		
"22,Youloveit,Youloveit Men's Seamless Elastic Slimming Waist Training Vest 
Slim Sweatshirt Fitness Exercise Abdominal Muscle Slimwear,17.99,,,2023-
03-06,Waist Trainer"		
23,Sportswear Men's Tank,,18.99,,,2023-03-06,Trainer Vests		
"24,Dri-Fit Tank Top Mens,""This Mens Dri-Fit Tank Top has been designed for 
high performance wear. Made to wick moisture away from the skin, this tank 
top features a crew neck design and flexible shoulder straps for ease of 
movement. Complete with the Nike Swoosh logo at the chest, this piece is a 
must have for those who really love to train and work out."",13.5,,,2023-
03-06,Trainer Vests"		
"25,Armour Baseline Tank Top Mens,""This Under Armour Baseline Tank Top will 
boost your performance on the court. Crafted in a super-soft cotton blend 
that dries fast, the vest features a crew neck, dropped armholes for extra 
mobility, a shaped hem for enhanced coverage and a 4-way stretch material 
to provide ultimate mobility."",20.99,,,2023-03-06,Trainer Vests"		
"26,Curry Performance Vest Mens,This Under Armour Curry Performance Vest is 
a sleeveless style crafted with a ribbed crew neckline for a classic look. 
It features flat lock seams to prevent chafing and is a lightweight 
construction. This vest is a solid colouring throughout designed with a 
signature logo and is complete with Under Armour branding.,16.5,,,2023-03-
06,Trainer Vests"		
"27,SHORT SLEEVE VEST,Designed to shape and provide everyday comfort. Wear 
under a casual tee or button-down and give your body an all-over sleeker 
physique with compression support that feels like a second
skin. Machine "		
Washable.,98,,,2023-03-06,Trainer Vests		
28,Amoena Pamela Seamless Non Underwired Pocketed Surgical		Bra,The new 
Amoena	Pamela post-surgery seamless post surgical compression bra is pre-	
washed	& packaged - ready for clinical use. Zoning provides special 	
"support in different areas.,99.95,,,2023-03-06,Trainer Vests
29,POST SURGERY SYMMASTIA BRA,""This bra is constructed with a high-
performance ComprexxWear fabric. It is breathable, lightweight, and feels 
silky smooth. This garment provides the right amount of compression to 
help improve blood circulation, reduce swelling and speed up the healing 
process."",44.1,,,2023-03-06,post-surgical"		
"30,POST SURGERY BREAST IMPLANT STABILISER BAND,""Designed with Velcro 
closure, the Stabilizer Band is durable, flexible cotton bands that 
provide support and stability after having breast surgery. It can also 
been worn underneath your regular bra. Ideal for the patient recovering 
from a breast lift (mastopexy)."",19.95,,,2023-03-06,post-surgical"		
"31,BRA: ALICE POST-OP BRA WITH HOOK & EYE,""Alice is a feminine post-op bra 
with integrated support zones for the best surgical result. It is fully 
openable, allowing easy examination."",55,,,2023-03-06,undergarments
32,POST SURGERY BODY SUIT WITH BRA - BELOW KNEE,""The Isavela Stage 1 Body 
Suit with Bra - Below Knee is designed with a built-in surgical 
compression bra, in below knee length, zipper on both sides, high back 
compression support of the back and an open crotch."",220.5,,,2023-03-
06,post-surgical"		
"33,Men's Firm Compression Singlet,This men's racerback singlet is ideal 
for gym and daily use. It is made of stretch cotton that will allow you 
greater range of motions. Features firm compression to streamline your 
figure
and give you back support. ,59,,,2023-03-06,undergarments"		
34,Leo	"Extra Firm Athletic Control Tank,""Lose the belly and harden your "	
chest!	An innovative Leo design that took the men's control tank and added 	
"extra firm control. Featuring double the control in the abs and back, plus 
double the comfort. Back is supported and chest is firmed. A supplemental 
garment to improving your physique."",48,,,2023-03-06,undergarments
35,Men's Firm Body Shaper Vest with Back Support Max/Force,""This shaper 
vest firmly compresses your entire torso. It s made with our PowerSlim 
fabric: double-layered at the bottom to compress abs and correct your 
posture, single-layered at the top to compress the chest. It has a perfect 
fit and offers the appearance of a toned silhouette under your 
clothes."",92,,,2023-03-06,shapewear"		
36,New	"Leo Crew Neck Seamless Control Tank,""If it's hard abs, zero "	
"visibility, but without the
jackpot! This Leo crew neck"		"heat you're looking for you've hit the 
control tank is seamless, but with super "
"strength ab control to create the effect of harder abs. "",46,,,2023-03-
06,undergarments"		
37,Men	"s Extra High-Waisted Moderate Shaping Brief,""Look great, feel "	
great!	This brief is made with two layers of our trademark DuraFit® 	
"moderate compression fabric to flatten the abs while shaping your waist 
and back. It s extra high-waisted for superior coverage and shaping. It 
adds ab definition and helps with back support. An anti-slip grip lining 
at the
top of the shaper keeps it in place no matter what, preventing "		
"roll-down."",25,,,2023-03-06,shapewear"		
38,Leo	"Post-Surgical Compression Bodysuit,""Lose up to 2 sizes in your abs! "	
"This Leo men's compression shaper helps flatten and tone the abdomen, 
chest and back. Provides back control, support and posture
correction"",131,,,2023-03-06,post-surgical"		
39,Leo	High Waist Stomach Shaper with Boxer Brief,Get the ab definition 	
"you strive for! This high waist control boxer brief can be the extra 
support you need during workouts/hard labor or the ideal physique you're "		
headed	for. ,58,,,2023-03-06,shapewear	
"40,Men
shaper"	"s Firm Shaper Vest with Back Support Front Hook Closure,""This 
vest firmly compresses the entire torso. It s made of double-"	
"layered PowerSlim® - our trademark firm compression fabricto sculpt the 
chest, abs, and back. This shaper has a 3-level adjustable front hook-and-
eye closure with a protective inner lining to prevent metal-on-skin 
contact."",102,,,2023-03-06,shapewear"		
"41,Leo Men´s Padded Butt Enhancer Brief,""Look naturally photoshopped with 
an enhanced butt! This Leo men´s padded butt enhancer brief has all the 
benefits of a regular brief, but with removable contour padding and a
special design to lift your butt. Wide waistband lies flush for 
comfort."",54,,,2023-03-06,shapewear"		
"42,Men's Padded Bum Enhancer Boxer Brief,""This men's padded boxer brief 
gives the bum a naturally enhanced look. In addition, this brief features 
ergonomic pouch to provide you comfort and support along with the 
breathable mesh legs and crotch that allow for greater breathability and 
ceaseless comfort."",55,,,2023-03-06,""undergarments, shapewear"""		
"43,Leo Men's Padded Butt Enhancer Boxer Brief,Naturally enhance the size 
of your glutes! This innovative Leoboxer brief is designed to lift the "		
"glutes and increase its size with removable padding.,54,,,2023-03-
06,""undergarments, shapewear"""	
"44,MAXI SEXY WAISTNIPPER,The Maxi Sexy Waistnipper is made
and smooth fabric that is comfortable to wear all day. The"	"of a powerful 
powernet lining "
"and flexible bones ensure an optimal shaping of the waistline and 
bulges.,39.99,,,2023-03-06,Trainer Vests"	
"45,WAISTNIPPER,The MAGIC Waist Nipper slims your entire midriff area. Look 
slim and sexy while giving your back extra support with this shaping 
waistband! The waistband is made of a comfortable and soft
fabric.,28.99,,,2023-03-06,Trainer Vests"	
"46,COMFORT THONG,""The Comfort Thong is a shaping thong that is made of a 
soft, light, and comfortable fabric. The thong provides light shaping to 
the lower tummy and back."",16.99,,,2023-03-06,""undergarments, shapewear""
47,COMFORT BRA,""The MAGIC Comfort Bra is the ideal bra for everyday wear, 
providing support and ultimate comfort. This bra features a seamless and 
wireless design with built-in support. The bra has a smooth back and wide 
straps for more support. "",21.99,,,2023-03-06,undergarments"	
"48,MAXI SEXY BODYBRIEFER,""The Maxi Sexy Bodybriefer is made with powerful 
and smooth fabric to provide firm control to the
tummy, waist, and back. "	
"This bodybriefer is invisible under clothes, has invisible edges, and is 
easy to wear with your own bra. The hook and eye
closure at the bottom "	
"guarantee comfort and ease during the day."",48.99,,,2023-03-
06,undergarments"	
"49,ARRIVAL TANK,""Perform more in the classic Arrival Tank. This tank 
boasts fundamental performance technology for next-level results, with 
sweat-wicking properties and a lightweight material that enables maximum 
movement and exertion."",18,,,2023-03-06,Trainer Vests"	
"50,LEGACY DROP ARM TANK,""A collection designed to make gains and build 
legacies. Old-school styles meet new-school functionalities with classic 
cuts, fresh fabrics and a graphic that nods to our Gymshark legacy. It’s 
what our legacy was built on."",22,,,2023-03-06,Trainer Vests"	
"51,REACT DROP ARM TANK,""New and improved React gets the job done, every 
time. A minimalist design means you’ll have full focus on your training, 
and new physique-accentuating seams and panels provide an understated 
lifting aesthetic."",25,,,2023-03-06,Trainer Vests"	
"52,315 SEAMLESS TANK,""There’s no room for distractions when you’re repping 
out. That’s why 315 is designed to fade seamlessly into the background, so 
you can tune out the world and focus on the lift."",35,,,2023-03-06,Trainer 
Vests"	
"53,SOCIAL CLUB DROP ARM TANK,""Show them which club you belong to. With 
bold Gymshark Lifting Club branding in a collegiate-style seasonal colour, 
the Gymshark Social Club collection is your new must-have."",78,,,2023-03-
06,Trainer Vests"	
