1	Fajas Delie Sale	FLASH10	1	2022-01-23	2024-01-23	10 % off all fajas delie products
2	Capri Jeans Sale	CJ5	1	2022-02-06	2024-01-24	All Capri jeans are 5% off all color and Sizes
3	Colombian Jeans Sale	COL15	1	2022-03-22	2024-01-25	15% off all Colombian Jeans
4	Crop Tops 5% off	TOP5	1	2023-03-06	2024-01-26	All crop tops are 5% off
5	Shorts Sale 10% off	SHORT10	1	2023-03-06	2024-01-27	All current shorts are 10% off
6	Fajas Stagmi at 5% off	STAG5	1	2023-03-06	2024-01-28	All current Stagmi products are discounted for 5%
7	Ann Michell 5% off	ANN1	1	2023-03-06	2024-01-29	All current Ann Michell are 5% off
